{
  "$schema": "http://json-schema.org/draft-07/schema#",
  "type": "object",
  "additionalProperties": false,
  "required": ["id", "version", "assets", "references", "audit"],
  "properties": {
    "id": {
      "type": "string",
      "minLength": 1
    },
    "version": {
      "type": "string",
      "minLength": 1
    },
    "audit": {
      "type": "object",
      "additionalProperties": false,
      "required": ["created_at", "created_by"],
      "properties": {
        "created_at": {
          "type": "string",
          "minLength": 1
        },
        "created_by": {
          "type": "string",
          "minLength": 1
        },
        "source_commit": {
          "type": ["string", "null"],
          "minLength": 1
        }
      }
    },
    "references": {
      "type": "object",
      "additionalProperties": false,
      "required": ["methodology"],
      "properties": {
        "methodology": {
          "type": "string",
          "minLength": 1
        },
        "meta_path": {
          "type": "string",
          "minLength": 1
        },
        "doc": {
          "type": ["string", "null"]
        },
        "url": {
          "type": ["string", "null"]
        }
      }
    },
    "assets": {
      "type": "array",
      "minItems": 1,
      "items": {
        "type": "object",
        "additionalProperties": false,
        "required": ["path", "sha256", "kind", "bytes"],
        "properties": {
          "path": {
            "type": "string",
            "minLength": 1
          },
          "kind": {
            "type": "string",
            "minLength": 1
          },
          "sha256": {
            "type": "string",
            "pattern": "^[0-9a-f]{64}$"
          },
          "bytes": {
            "type": "integer",
            "minimum": 0
          },
          "size": {
            "type": "integer",
            "minimum": 0
          },
          "doc": {
            "type": ["string", "null"]
          },
          "url": {
            "type": ["string", "null"]
          },
          "lfs": {
            "type": "boolean"
          }
        }
      }
    }
  }
}
