{
  "id": "UNFCCC.Forestry.AR-AMS0003",
  "version": "v02-0",
  "audit": {
    "created_at": "2025-11-06T10:02:41Z",
    "created_by": "scripts/generate-tools-meta.js",
    "source_commit": "ae215a5daa98f2764370a599e03acebbe7d77dbd"
  },
  "references": {
    "methodology": "UNFCCC.Forestry.AR-AMS0003@v02-0",
    "meta_path": "methodologies/UNFCCC/Forestry/AR-AMS0003/v02-0/META.json",
    "doc": null,
    "url": null
  },
  "assets": [
    {
      "path": "tools/UNFCCC/Forestry/AR-AMS0003/v02-0/source.pdf",
      "kind": "pdf",
      "sha256": "fb93c1b522e3439d97aace522ea9f990d69976e79afb3723013e24d92fe7b3fa",
      "bytes": 237872,
      "size": 237872,
      "doc": "UNFCCC/AR-AMS0003@v02.0",
      "url": null,
      "lfs": true
    }
  ]
}
