{
  "id": "UNFCCC.Agriculture.AMS-III.D",
  "version": "v21-0",
  "audit": {
    "created_at": "2025-11-06T10:56:51Z",
    "created_by": "scripts/generate-tools-meta.js",
    "source_commit": "ae215a5daa98f2764370a599e03acebbe7d77dbd"
  },
  "references": {
    "methodology": "UNFCCC.Agriculture.AMS-III.D@v21-0",
    "meta_path": "methodologies/UNFCCC/Agriculture/AMS-III/D/v21-0/META.json",
    "doc": null,
    "url": "https://cdm.unfccc.int/methodologies/DB/H9DVSB24O7GEZQYLYNWUX23YS6G4RC"
  },
  "assets": [
    {
      "path": "tools/UNFCCC/Agriculture/AMS-III/D/v21-0/Baseline-project-and-or-leakage-emissions-from-electricity-consumption-and-monitoring-of-electricity-generation.pdf",
      "kind": "pdf",
      "sha256": "b292e66001d2e854af3176e4f922ce922cb6faa426d88f6071a2f1a64f353c51",
      "bytes": 572432,
      "size": 572432,
      "doc": "",
      "url": null,
      "lfs": true
    },
    {
      "path": "tools/UNFCCC/Agriculture/AMS-III/D/v21-0/Project-and-leakage-emissions-from-anaerobic-digesters.pdf",
      "kind": "pdf",
      "sha256": "0788effccd28e867dfee522e5c413ca4d47240c75acce3a05d6d0cf759a3d1d0",
      "bytes": 325737,
      "size": 325737,
      "doc": "",
      "url": null,
      "lfs": true
    },
    {
      "path": "tools/UNFCCC/Agriculture/AMS-III/D/v21-0/Project-emissions-from-flaring.pdf",
      "kind": "pdf",
      "sha256": "0a806611660fab64122335bd85c8c20974c8932b3e063592692b7d2230162907",
      "bytes": 426246,
      "size": 426246,
      "doc": "",
      "url": null,
      "lfs": true
    },
    {
      "path": "tools/UNFCCC/Agriculture/AMS-III/D/v21-0/source.pdf",
      "kind": "pdf",
      "sha256": "a9c6c73c84f2bc3bbde7ccdac996accadec15f33cb2da10cd95227ac8373a4c4",
      "bytes": 853732,
      "size": 853732,
      "doc": "UNFCCC/D@v21.0",
      "url": null,
      "lfs": true
    },
    {
      "path": "tools/UNFCCC/Agriculture/AMS-III/D/v21-0/Tool-to-calculate-project-or-leakage-CO2-emissions-from-fossil-fuel-combustion.pdf",
      "kind": "pdf",
      "sha256": "64bb83daec11116f8eaab00ca0d03ecdcb41be64076976b972d774b267ca6e02",
      "bytes": 447750,
      "size": 447750,
      "doc": "",
      "url": null,
      "lfs": true
    }
  ]
}
