{
  "id": "UNFCCC.Forestry.AR-AMS0007",
  "version": "v03-1",
  "audit": {
    "created_at": "2025-11-06T10:03:04Z",
    "created_by": "scripts/generate-tools-meta.js",
    "source_commit": "ae215a5daa98f2764370a599e03acebbe7d77dbd"
  },
  "references": {
    "methodology": "UNFCCC.Forestry.AR-AMS0007@v03-1",
    "meta_path": "methodologies/UNFCCC/Forestry/AR-AMS0007/v03-1/META.json",
    "doc": null,
    "url": "https://cdm.unfccc.int/methodologies/DB/J6ZHLX1C3AEMSZ52PWIII6D2AOJZUB"
  },
  "assets": [
    {
      "path": "tools/UNFCCC/Forestry/AR-AMS0007/v03-1/ar-am-tool-02-v1.pdf",
      "kind": "pdf",
      "sha256": "37324fd7d9e727d006bd7e46b5410acff24acbe2195a65229a70a27041bbe4b4",
      "bytes": 251692,
      "size": 251692,
      "doc": "",
      "url": null,
      "lfs": true
    },
    {
      "path": "tools/UNFCCC/Forestry/AR-AMS0007/v03-1/ar-am-tool-08-v4.0.0.pdf",
      "kind": "pdf",
      "sha256": "c54deaf3cbe89fa8765ec34af186400e74c08545de646d41af7a93a50565e397",
      "bytes": 263864,
      "size": 263864,
      "doc": "",
      "url": null,
      "lfs": true
    },
    {
      "path": "tools/UNFCCC/Forestry/AR-AMS0007/v03-1/ar-am-tool-12-v3.1.pdf",
      "kind": "pdf",
      "sha256": "b921a0a3b5c1e2e8791526b0ca0e183ca81dd35db59e515bb89771af692863f4",
      "bytes": 275971,
      "size": 275971,
      "doc": "",
      "url": null,
      "lfs": true
    },
    {
      "path": "tools/UNFCCC/Forestry/AR-AMS0007/v03-1/ar-am-tool-14-v4.2.pdf",
      "kind": "pdf",
      "sha256": "b63fccecaf7730e9f1d461ef51cefea2252e89dbb5a630869c9e265b23577331",
      "bytes": 691428,
      "size": 691428,
      "doc": "",
      "url": null,
      "lfs": true
    },
    {
      "path": "tools/UNFCCC/Forestry/AR-AMS0007/v03-1/ar-am-tool-15-v2.0.pdf",
      "kind": "pdf",
      "sha256": "b8e0252fc7bcfadc184dbb2dab12205c85d6d4af5a291b39128bd861ab878e29",
      "bytes": 1008516,
      "size": 1008516,
      "doc": "",
      "url": null,
      "lfs": true
    },
    {
      "path": "tools/UNFCCC/Forestry/AR-AMS0007/v03-1/ar-am-tool-16-v1.1.0.pdf",
      "kind": "pdf",
      "sha256": "edc718dba7eb097092907553f849c10a36e91a3b4199677ccf4a78748a92f8de",
      "bytes": 255568,
      "size": 255568,
      "doc": "",
      "url": null,
      "lfs": true
    },
    {
      "path": "tools/UNFCCC/Forestry/AR-AMS0007/v03-1/AR-TOOL08_v4-0-0.pdf",
      "kind": "pdf",
      "sha256": "c54deaf3cbe89fa8765ec34af186400e74c08545de646d41af7a93a50565e397",
      "bytes": 263864,
      "size": 263864,
      "doc": "UNFCCC/AR-TOOL08@v4.0.0",
      "url": null,
      "lfs": true
    },
    {
      "path": "tools/UNFCCC/Forestry/AR-AMS0007/v03-1/AR-TOOL12_v3-1.pdf",
      "kind": "pdf",
      "sha256": "b921a0a3b5c1e2e8791526b0ca0e183ca81dd35db59e515bb89771af692863f4",
      "bytes": 275971,
      "size": 275971,
      "doc": "UNFCCC/AR-TOOL12@v3.1",
      "url": null,
      "lfs": true
    },
    {
      "path": "tools/UNFCCC/Forestry/AR-AMS0007/v03-1/AR-TOOL14_v4-2.pdf",
      "kind": "pdf",
      "sha256": "b63fccecaf7730e9f1d461ef51cefea2252e89dbb5a630869c9e265b23577331",
      "bytes": 691428,
      "size": 691428,
      "doc": "UNFCCC/AR-TOOL14@v4.2",
      "url": null,
      "lfs": true
    },
    {
      "path": "tools/UNFCCC/Forestry/AR-AMS0007/v03-1/AR-TOOL15_v2-0.pdf",
      "kind": "pdf",
      "sha256": "b8e0252fc7bcfadc184dbb2dab12205c85d6d4af5a291b39128bd861ab878e29",
      "bytes": 1008516,
      "size": 1008516,
      "doc": "UNFCCC/AR-TOOL15@v2.0",
      "url": null,
      "lfs": true
    },
    {
      "path": "tools/UNFCCC/Forestry/AR-AMS0007/v03-1/AR-TOOL16_v1-1-0.pdf",
      "kind": "pdf",
      "sha256": "edc718dba7eb097092907553f849c10a36e91a3b4199677ccf4a78748a92f8de",
      "bytes": 255568,
      "size": 255568,
      "doc": "UNFCCC/AR-TOOL16@v1.1.0",
      "url": null,
      "lfs": true
    },
    {
      "path": "tools/UNFCCC/Forestry/AR-AMS0007/v03-1/CDM-glossary.pdf",
      "kind": "pdf",
      "sha256": "62cbedc1d4fb3e66b9b37eb6ad2225eb998fad36aecdd20444095d7d46687e5c",
      "bytes": 277555,
      "size": 277555,
      "doc": "",
      "url": null,
      "lfs": true
    },
    {
      "path": "tools/UNFCCC/Forestry/AR-AMS0007/v03-1/Estimation-of-carbon-stocks-and-change-in-carbon-stocks-in-dead-wood-and-litter-in-A-R-CDM-project-activities.pdf",
      "kind": "pdf",
      "sha256": "b921a0a3b5c1e2e8791526b0ca0e183ca81dd35db59e515bb89771af692863f4",
      "bytes": 275971,
      "size": 275971,
      "doc": "",
      "url": null,
      "lfs": true
    },
    {
      "path": "tools/UNFCCC/Forestry/AR-AMS0007/v03-1/Estimation-of-carbon-stocks-and-change-in-carbon-stocks-of-trees-and-shrubs-in-A-RCDM-project-activities.pdf",
      "kind": "pdf",
      "sha256": "b63fccecaf7730e9f1d461ef51cefea2252e89dbb5a630869c9e265b23577331",
      "bytes": 691428,
      "size": 691428,
      "doc": "",
      "url": null,
      "lfs": true
    },
    {
      "path": "tools/UNFCCC/Forestry/AR-AMS0007/v03-1/Estimation-of-non-CO2-GHG-emissions-resulting-from-burning-of-biomass-attributable-to-an-A-R-CDM-project-activity.pdf",
      "kind": "pdf",
      "sha256": "c54deaf3cbe89fa8765ec34af186400e74c08545de646d41af7a93a50565e397",
      "bytes": 263864,
      "size": 263864,
      "doc": "",
      "url": null,
      "lfs": true
    },
    {
      "path": "tools/UNFCCC/Forestry/AR-AMS0007/v03-1/Estimation-of-the-increase-in-GHG-emissions-attributable-to-displacement-of-pre-project-agricultural-activities-in-A-R-CDM-project-activity.pdf",
      "kind": "pdf",
      "sha256": "b8e0252fc7bcfadc184dbb2dab12205c85d6d4af5a291b39128bd861ab878e29",
      "bytes": 1008516,
      "size": 1008516,
      "doc": "",
      "url": null,
      "lfs": true
    },
    {
      "path": "tools/UNFCCC/Forestry/AR-AMS0007/v03-1/source.docx",
      "kind": "docx",
      "sha256": "2f73349cfc4630255319c6c8dfc1b46a8996ace9d14d8e07563b165915918ec2",
      "bytes": 12,
      "size": 12,
      "doc": "UNFCCC/AR-AMS0007@v03.1",
      "url": null,
      "lfs": false
    },
    {
      "path": "tools/UNFCCC/Forestry/AR-AMS0007/v03-1/source.pdf",
      "kind": "pdf",
      "sha256": "2facdc8509c8dd2c7da4ca884cec431ab9d7ceb6ec628decc330e550cbcf2bc9",
      "bytes": 209654,
      "size": 209654,
      "doc": "UNFCCC/AR-AMS0007@v03.1",
      "url": null,
      "lfs": true
    },
    {
      "path": "tools/UNFCCC/Forestry/AR-AMS0007/v03-1/Tool-for-estimation-of-change-in-soil-organic-carbon-stocks-due-to-the-implementation-of-A-R-CDM-project-activities.pdf",
      "kind": "pdf",
      "sha256": "edc718dba7eb097092907553f849c10a36e91a3b4199677ccf4a78748a92f8de",
      "bytes": 255568,
      "size": 255568,
      "doc": "",
      "url": null,
      "lfs": true
    }
  ]
}
