{
  "id": "UNFCCC.Forestry.AR-AM0014",
  "version": "v03-0",
  "audit": {
    "created_at": "2025-11-06T10:01:51Z",
    "created_by": "scripts/generate-tools-meta.js",
    "source_commit": "ae215a5daa98f2764370a599e03acebbe7d77dbd"
  },
  "references": {
    "methodology": "UNFCCC.Forestry.AR-AM0014@v03-0",
    "meta_path": "methodologies/UNFCCC/Forestry/AR-AM0014/v03-0/META.json",
    "doc": null,
    "url": "https://cdm.unfccc.int/methodologies/DB/KMH6O8T6RL3P5XKNBQE2N359QG7KOE"
  },
  "assets": [
    {
      "path": "tools/UNFCCC/Forestry/AR-AM0014/v03-0/ar-am-tool-02-v1.pdf",
      "kind": "pdf",
      "sha256": "37324fd7d9e727d006bd7e46b5410acff24acbe2195a65229a70a27041bbe4b4",
      "bytes": 251692,
      "size": 251692,
      "doc": "",
      "url": null,
      "lfs": true
    },
    {
      "path": "tools/UNFCCC/Forestry/AR-AM0014/v03-0/ar-am-tool-08-v4.0.0.pdf",
      "kind": "pdf",
      "sha256": "c54deaf3cbe89fa8765ec34af186400e74c08545de646d41af7a93a50565e397",
      "bytes": 263864,
      "size": 263864,
      "doc": "",
      "url": null,
      "lfs": true
    },
    {
      "path": "tools/UNFCCC/Forestry/AR-AM0014/v03-0/ar-am-tool-12-v3.1.pdf",
      "kind": "pdf",
      "sha256": "b921a0a3b5c1e2e8791526b0ca0e183ca81dd35db59e515bb89771af692863f4",
      "bytes": 275971,
      "size": 275971,
      "doc": "",
      "url": null,
      "lfs": true
    },
    {
      "path": "tools/UNFCCC/Forestry/AR-AM0014/v03-0/ar-am-tool-14-v4.2.pdf",
      "kind": "pdf",
      "sha256": "b63fccecaf7730e9f1d461ef51cefea2252e89dbb5a630869c9e265b23577331",
      "bytes": 691428,
      "size": 691428,
      "doc": "",
      "url": null,
      "lfs": true
    },
    {
      "path": "tools/UNFCCC/Forestry/AR-AM0014/v03-0/ar-am-tool-15-v2.0.pdf",
      "kind": "pdf",
      "sha256": "b8e0252fc7bcfadc184dbb2dab12205c85d6d4af5a291b39128bd861ab878e29",
      "bytes": 1008516,
      "size": 1008516,
      "doc": "",
      "url": null,
      "lfs": true
    },
    {
      "path": "tools/UNFCCC/Forestry/AR-AM0014/v03-0/CDM-glossary.pdf",
      "kind": "pdf",
      "sha256": "62cbedc1d4fb3e66b9b37eb6ad2225eb998fad36aecdd20444095d7d46687e5c",
      "bytes": 277555,
      "size": 277555,
      "doc": "",
      "url": null,
      "lfs": true
    },
    {
      "path": "tools/UNFCCC/Forestry/AR-AM0014/v03-0/Combined-tool-to-identify-the-baseline-scenario-and-demonstrate-additionality-in-A-R-CDM-project-activities.pdf",
      "kind": "pdf",
      "sha256": "37324fd7d9e727d006bd7e46b5410acff24acbe2195a65229a70a27041bbe4b4",
      "bytes": 251692,
      "size": 251692,
      "doc": "",
      "url": null,
      "lfs": true
    },
    {
      "path": "tools/UNFCCC/Forestry/AR-AM0014/v03-0/EB75_repan29_AR-AM0014_ver03.0.pdf",
      "kind": "pdf",
      "sha256": "5484c0392761c9d7b4cca9e3f66e8e72d353fff371da45cb0ba2a3d254b8eb1a",
      "bytes": 1131963,
      "size": 1131963,
      "doc": "",
      "url": null,
      "lfs": true
    },
    {
      "path": "tools/UNFCCC/Forestry/AR-AM0014/v03-0/Estimation-of-carbon-stocks-and-change-in-carbon-stocks-in-dead-wood-and-litter-in-A-R-CDM-project-activities.pdf",
      "kind": "pdf",
      "sha256": "b921a0a3b5c1e2e8791526b0ca0e183ca81dd35db59e515bb89771af692863f4",
      "bytes": 275971,
      "size": 275971,
      "doc": "",
      "url": null,
      "lfs": true
    },
    {
      "path": "tools/UNFCCC/Forestry/AR-AM0014/v03-0/Estimation-of-carbon-stocks-and-change-in-carbon-stocks-of-trees-and-shrubs-in-A-RCDM-project-activities.pdf",
      "kind": "pdf",
      "sha256": "b63fccecaf7730e9f1d461ef51cefea2252e89dbb5a630869c9e265b23577331",
      "bytes": 691428,
      "size": 691428,
      "doc": "",
      "url": null,
      "lfs": true
    },
    {
      "path": "tools/UNFCCC/Forestry/AR-AM0014/v03-0/Estimation-of-non-CO2-GHG-emissions-resulting-from-burning-of-biomass-attributable-to-an-A-R-CDM-project-activity.pdf",
      "kind": "pdf",
      "sha256": "c54deaf3cbe89fa8765ec34af186400e74c08545de646d41af7a93a50565e397",
      "bytes": 263864,
      "size": 263864,
      "doc": "",
      "url": null,
      "lfs": true
    },
    {
      "path": "tools/UNFCCC/Forestry/AR-AM0014/v03-0/Estimation-of-the-increase-in-GHG-emissions-attributable-to-displacement-of-pre-project-agricultural-activities-in-A-R-CDM-project-activity.pdf",
      "kind": "pdf",
      "sha256": "b8e0252fc7bcfadc184dbb2dab12205c85d6d4af5a291b39128bd861ab878e29",
      "bytes": 1008516,
      "size": 1008516,
      "doc": "",
      "url": null,
      "lfs": true
    },
    {
      "path": "tools/UNFCCC/Forestry/AR-AM0014/v03-0/source.pdf",
      "kind": "pdf",
      "sha256": "5484c0392761c9d7b4cca9e3f66e8e72d353fff371da45cb0ba2a3d254b8eb1a",
      "bytes": 1131963,
      "size": 1131963,
      "doc": "UNFCCC/AR-AM0014@v03.0",
      "url": null,
      "lfs": true
    }
  ]
}
